{
  "schema_version": 1,
  "id": "cb5a0a56-ce66-422b-937d-1885329aad41",
  "revision": 1,
  "context_version": 1,
  "last_event_id": "ad6ad265-22d5-4259-99b7-bdfeffd889ce",
  "title": "Draft the project kickoff agenda",
  "description": "Prepare an agenda for the next project kickoff. Synthetic example; no message has been sent.",
  "status": "candidate",
  "flow": "actionable",
  "priority": "normal",
  "tags": [
    "planning"
  ],
  "created_at": "2026-10-19T08:00:00Z",
  "updated_at": "2026-10-19T08:00:00Z",
  "created_by": "example-user",
  "scheduled_for": "2026-10-20T07:00:00Z",
  "due_at": null,
  "follow_up_at": null,
  "context": {
    "objective": "Produce a short agenda for user review.",
    "constraints": [
      "Do not send invitations or contact attendees."
    ],
    "notes": "The assistant will need the user's project context before drafting."
  },
  "completion": {
    "version": 1,
    "criteria": [
      {
        "id": "criterion-1",
        "description": "Agenda covers goals, scope, decisions, and next steps."
      }
    ]
  },
  "sources": [
    {
      "provider": "example",
      "reference": "example://kickoff-001",
      "captured_at": "2026-10-19T08:00:00Z",
      "summary": "A kickoff agenda is needed. This is synthetic source data."
    }
  ],
  "ingestion": {
    "producer": "example-routine",
    "external_key": "[\"example\",\"kickoff-001\",\"prepare-agenda\",\"once\"]"
  }
}
